{
  "achieved_assurance_level": "L0",
  "confirmation_statement": "Accepted",
  "confirmation_timestamp": "2026-08-14T16:09:21.792617Z",
  "confirmed_content_digest": "71c76afa7b5595aa8f3a1c6c4a16e14271653388e63859ab5caaf0e8afa07d1f",
  "confirmer_identity_evidence": {
    "captured_at": "2026-08-14T16:09:21.792617Z",
    "evidence_kind": "typed_confirmation_only",
    "identifier": "Atila Madai"
  },
  "contract_version": "CHGR-001/1.0",
  "created_at": "2026-08-14T16:09:27.726621Z",
  "extensions": {},
  "limitations": [],
  "preview_rendering_digest": "71c76afa7b5595aa8f3a1c6c4a16e14271653388e63859ab5caaf0e8afa07d1f",
  "record_digest": "56df04f71fe1ebd66697fab2b8118623b367f50a2427afea930a6f4c6470bdc6",
  "record_id": "chgrconf-71ceda34408e4c469b5a799c01774364",
  "record_type": "human_confirmation_evidence",
  "schema_id": "https://pcae.local/schemas/chgr/records/human_confirmation_evidence.schema.json",
  "schema_version": "1.0"
}
