{
  "achieved_assurance_level": "L0",
  "confirmation_statement": "I confirm this is my synthetic fixture decision.",
  "confirmation_timestamp": "2026-07-23T00:00:00Z",
  "confirmed_content_digest": "edc77daddb070bdbb84f7ac5b0d1d4542bf3c5550558c23facdbd61b6a4053c3",
  "confirmer_identity_evidence": {
    "captured_at": "2026-07-23T00:00:00Z",
    "evidence_kind": "typed_confirmation_only",
    "identifier": "unavailable"
  },
  "contract_version": "CHGR-001/1.0",
  "created_at": "2026-07-23T00:00:00Z",
  "extensions": {},
  "limitations": [
    "This is a synthetic fixture; no real confirmation occurred."
  ],
  "preview_rendering_digest": "edc77daddb070bdbb84f7ac5b0d1d4542bf3c5550558c23facdbd61b6a4053c3",
  "record_digest": "ca95401dbf6bc26c51d699c29897ce97ce39b8233b99b43dcfa7cb79be0a573c",
  "record_id": "chgrconf-af23221732aa437db2e8b6364274e609",
  "record_type": "human_confirmation_evidence",
  "schema_id": "https://pcae.local/schemas/chgr/records/human_confirmation_evidence.schema.json",
  "schema_version": "1.0"
}
