{
  "achieved_assurance_level": "L0",
  "confirmation_statement": "Accepted",
  "confirmation_timestamp": "2026-08-20T19:36:30.960445Z",
  "confirmed_content_digest": "037f34ff49fb904b280b3a8d66107a7791c4a7de7680bbdbd21efce30c9ed426",
  "confirmer_identity_evidence": {
    "captured_at": "2026-08-20T19:36:30.960445Z",
    "evidence_kind": "typed_confirmation_only",
    "identifier": "Atila Madai"
  },
  "contract_version": "CHGR-001/1.0",
  "created_at": "2026-08-20T19:36:36.459869Z",
  "extensions": {},
  "limitations": [],
  "preview_rendering_digest": "037f34ff49fb904b280b3a8d66107a7791c4a7de7680bbdbd21efce30c9ed426",
  "record_digest": "b7fe31d8122342ccbd86b3c6902746e912549666543ffbd38ad2c48c61df971d",
  "record_id": "chgrconf-75a89a2e144b4d8f99ace2394311eca7",
  "record_type": "human_confirmation_evidence",
  "schema_id": "https://pcae.local/schemas/chgr/records/human_confirmation_evidence.schema.json",
  "schema_version": "1.0"
}
