{
  "achieved_assurance_level": "L0",
  "confirmation_statement": "Accepted",
  "confirmation_timestamp": "2026-08-15T15:31:14.822261Z",
  "confirmed_content_digest": "86100786ad3838b149ad196570342b4acf111403387de9b550f84e4a3d33387c",
  "confirmer_identity_evidence": {
    "captured_at": "2026-08-15T15:31:14.822261Z",
    "evidence_kind": "typed_confirmation_only",
    "identifier": "Atila Madai"
  },
  "contract_version": "CHGR-001/1.0",
  "created_at": "2026-08-15T15:31:19.215041Z",
  "extensions": {},
  "limitations": [],
  "preview_rendering_digest": "86100786ad3838b149ad196570342b4acf111403387de9b550f84e4a3d33387c",
  "record_digest": "c0ba37cd103839eeb3e328b726428408a38b2a1b03d26631c7a56fb40db197f5",
  "record_id": "chgrconf-51029a1d6bb0451badc1fe464ac9a457",
  "record_type": "human_confirmation_evidence",
  "schema_id": "https://pcae.local/schemas/chgr/records/human_confirmation_evidence.schema.json",
  "schema_version": "1.0"
}
