{
  "achieved_assurance_level": "L0",
  "confirmation_statement": "Accepted",
  "confirmation_timestamp": "2026-08-15T04:19:57.186133Z",
  "confirmed_content_digest": "e49caf228bdbddda27277f1b37ad06cd71bd68a60bd5aa6a8faacd50d899033d",
  "confirmer_identity_evidence": {
    "captured_at": "2026-08-15T04:19:57.186133Z",
    "evidence_kind": "typed_confirmation_only",
    "identifier": "Atila Madai"
  },
  "contract_version": "CHGR-001/1.0",
  "created_at": "2026-08-15T04:20:10.151546Z",
  "extensions": {},
  "limitations": [],
  "preview_rendering_digest": "e49caf228bdbddda27277f1b37ad06cd71bd68a60bd5aa6a8faacd50d899033d",
  "record_digest": "cb31bae0139cb4534067619a43bea0185584fe1f8f0e59ccc637c7673aa25b6b",
  "record_id": "chgrconf-7fa5eba6c3944494a09718362322de26",
  "record_type": "human_confirmation_evidence",
  "schema_id": "https://pcae.local/schemas/chgr/records/human_confirmation_evidence.schema.json",
  "schema_version": "1.0"
}
